School District Name,% Teaches CS,Schools in Dist,District Student Population,Responding %
A-H-S-T COMM SCHOOL DISTRICT,0.00%,2,640,50.00%
ADAIR-CASEY COMM SCHOOL DISTRICT,0.00%,2,300,50.00%
ADEL DESOTO MINBURN COMM SCHOOL DISTRICT,25.00%,4,1657,50.00%
AGWSR COMM SCHOOL DISTRICT,0.00%,5,608,20.00%
AKRON WESTFIELD COMM SCHOOL DISTRICT,33.33%,3,553,33.33%
ALBERT CITY-TRUESDALE COMM SCHOOL DISTRICT,0.00%,1,107,100.00%
ALBIA COMM SCHOOL DISTRICT,60.00%,5,1219,60.00%
ALBURNETT COMM SCHOOL DISTRICT,33.33%,3,653,33.33%
ALDEN COMM SCHOOL DISTRICT,0.00%,1,267,100.00%
ALGONA COMM SCHOOL DISTRICT,0.00%,5,1441,20.00%
ALLAMAKEE COMM SCHOOL DISTRICT,20.00%,5,1140,20.00%
ALTA COMM SCHOOL DISTRICT,0.00%,2,556,50.00%
AMES COMM SCHOOL DISTRICT,12.50%,8,4433,25.00%
ANAMOSA COMM SCHOOL DISTRICT,33.33%,3,1282,66.67%
ANDREW COMM SCHOOL DISTRICT,0.00%,2,174,0.00%
ANKENY COMM SCHOOL DISTRICT,18.75%,16,10593,56.25%
APLINGTON-PARKERSBURG COMM SCHOOL DISTRICT,25.00%,4,868,75.00%
AR-WE-VA COMM SCHOOL DISTRICT,0.00%,2,237,50.00%
ATLANTIC COMM SCHOOL DISTRICT,50.00%,4,1531,75.00%
AUDUBON COMM SCHOOL DISTRICT,50.00%,2,576,50.00%
AURELIA COMM SCHOOL DISTRICT,0.00%,2,262,0.00%
BALLARD COMM SCHOOL DISTRICT,25.00%,4,1732,50.00%
BATTLE CREEK-IDA GROVE COMM SCHOOL DISTRICT,33.33%,3,634,66.67%
BAXTER COMM SCHOOL DISTRICT,0.00%,2,459,100.00%
BCLUW COMM SCHOOL DISTRICT,0.00%,3,641,33.33%
BEDFORD COMM SCHOOL DISTRICT,0.00%,2,479,50.00%
BELLE PLAINE COMM SCHOOL DISTRICT,100.00%,2,566,100.00%
BELLEVUE COMM SCHOOL DISTRICT,50.00%,2,694,50.00%
BELMOND-KLEMME COMM SCHOOL DISTRICT,66.67%,3,784,100.00%
BENNETT COMM SCHOOL DISTRICT,0.00%,1,86,0.00%
BENTON COMM SCHOOL DISTRICT,0.00%,6,1548,50.00%
BETTENDORF COMM SCHOOL DISTRICT,12.50%,8,4479,37.50%
BONDURANT-FARRAR COMM SCHOOL DISTRICT,50.00%,4,1847,50.00%
BOONE COMM SCHOOL DISTRICT,33.33%,6,2071,66.67%
BOYDEN-HULL COMM SCHOOL DISTRICT,50.00%,2,660,50.00%
BOYER VALLEY COMM SCHOOL DISTRICT,50.00%,2,483,50.00%
BROOKLYN-GUERNSEY-MALCOM COMM SCHOOL DISTRICT,0.00%,2,592,50.00%
BURLINGTON COMM SCHOOL DISTRICT,44.44%,9,4200,55.56%
CAL COMM SCHOOL DISTRICT,50.00%,2,258,50.00%
CALAMUS-WHEATLAND COMM SCHOOL DISTRICT,0.00%,2,521,50.00%
CAM COMM SCHOOL DISTRICT,14.29%,7,871,42.86%
CAMANCHE COMM SCHOOL DISTRICT,66.67%,3,1087,66.67%
CARDINAL COMM SCHOOL DISTRICT,50.00%,2,724,50.00%
CARLISLE COMM SCHOOL DISTRICT,50.00%,4,2121,100.00%
CARROLL COMM SCHOOL DISTRICT,0.00%,4,1800,25.00%
CEDAR FALLS COMM SCHOOL DISTRICT,36.36%,11,5237,81.82%
CEDAR RAPIDS COMM SCHOOL DISTRICT,25.81%,31,16351,29.03%
CENTER POINT-URBANA COMM SCHOOL DISTRICT,25.00%,4,1552,25.00%
CENTERVILLE COMM SCHOOL DISTRICT,12.50%,8,1389,37.50%
CENTRAL CITY COMM SCHOOL DISTRICT,66.67%,3,447,66.67%
CENTRAL COMM SCHOOL DISTRICT,100.00%,2,480,100.00%
CENTRAL DECATUR COMM SCHOOL DISTRICT,33.33%,3,760,33.33%
CENTRAL DEWITT SCHOOL DISTRICT,60.00%,5,1488,80.00%
CENTRAL LEE COMM SCHOOL DISTRICT,66.67%,3,1078,100.00%
CENTRAL LYON COMM SCHOOL DISTRICT,33.33%,3,732,66.67%
CENTRAL SPRINGS COMM SCHOOL DISTRICT,0.00%,4,809,50.00%
CHARITON COMM SCHOOL DISTRICT,25.00%,4,1337,25.00%
CHARLES CITY COMM SCHOOL DISTRICT,40.00%,5,1552,60.00%
CHARTER OAK-UTE COMM SCHOOL DISTRICT,0.00%,3,310,33.33%
CHEROKEE COMM SCHOOL DISTRICT,20.00%,5,1072,40.00%
CLARINDA COMM SCHOOL DISTRICT,50.00%,4,1197,75.00%
CLARION-GOLDFIELD-DOWS COMM SCHOOL DISTRICT,0.00%,3,1013,33.33%
CLARKE COMM SCHOOL DISTRICT,33.33%,3,1402,33.33%
CLARKSVILLE COMM SCHOOL DISTRICT,0.00%,2,344,50.00%
CLAY CENTRAL-EVERLY COMM SCHOOL DISTRICT,0.00%,2,325,100.00%
CLAYTON RIDGE COMM SCHOOL DISTRICT,20.00%,5,899,60.00%
CLEAR CREEK AMANA COMM SCHOOL DISTRICT,40.00%,5,2101,40.00%
CLEAR LAKE COMM SCHOOL DISTRICT,100.00%,3,1376,100.00%
CLEARFIELD COMM SCHOOL DISTRICT,0.00%,1,,0.00%
CLINTON COMM SCHOOL DISTRICT,50.00%,8,3505,50.00%
COLFAX-MINGO COMM SCHOOL DISTRICT,0.00%,3,701,33.33%
COLLEGE COMM SCHOOL DISTRICT,44.44%,9,5331,88.89%
COLLINS-MAXWELL COMM SCHOOL DISTRICT,0.00%,2,468,50.00%
COLO-NESCO SCHOOL COMM SCHOOL DISTRICT,16.67%,6,467,16.67%
COLUMBUS COMM SCHOOL DISTRICT,0.00%,3,793,33.33%
COON RAPIDS-BAYARD COMM SCHOOL DISTRICT,50.00%,2,414,50.00%
CORNING COMM SCHOOL DISTRICT,0.00%,3,454,33.33%
CORWITH-WESLEY COMM SCHOOL DISTRICT,0.00%,1,58,100.00%
COUNCIL BLUFFS COMM SCHOOL DISTRICT,50.00%,16,9117,68.75%
CRESTON COMM SCHOOL DISTRICT,20.00%,5,1443,40.00%
DALLAS CENTER-GRIMES COMM SCHOOL DISTRICT,33.33%,6,2692,50.00%
DANVILLE COMM SCHOOL DISTRICT,50.00%,2,664,50.00%
DAVENPORT COMM SCHOOL DISTRICT,28.57%,35,15569,40.00%
DAVIS COUNTY COMM SCHOOL DISTRICT,50.00%,4,1252,75.00%
DECORAH COMMUNITY SCHOOL DISTRICT,40.00%,5,1689,40.00%
DELWOOD COMM SCHOOL DISTRICT,100.00%,1,172,100.00%
DENISON COMM SCHOOL DISTRICT,20.00%,5,2224,80.00%
DENVER COMM SCHOOL DISTRICT,25.00%,4,767,25.00%
DES MOINES INDEPENDENT COMM SCHOOL DISTRICT,22.58%,62,32809,32.26%
DIAGONAL COMM SCHOOL DISTRICT,0.00%,2,120,50.00%
DIKE-NEW HARTFORD COMM SCHOOL DISTRICT,50.00%,4,907,50.00%
DOWS COMM SCHOOL DISTRICT,0.00%,1,,0.00%
DUBUQUE COMM SCHOOL DISTRICT,5.56%,18,10698,38.89%
DUNKERTON COMM SCHOOL DISTRICT,50.00%,2,493,100.00%
DURANT COMM SCHOOL DISTRICT,66.67%,3,703,66.67%
EAGLE GROVE COMM SCHOOL DISTRICT,66.67%,3,849,100.00%
EARLHAM COMM SCHOOL DISTRICT,66.67%,3,654,66.67%
EAST BUCHANAN COMM SCHOOL DISTRICT,33.33%,3,624,33.33%
EAST GREENE COMM SCHOOL DISTRICT,0.00%,2,,0.00%
EAST MARSHALL COMM SCHOOL DISTRICT,0.00%,4,894,25.00%
EAST MILLS COMM SCHOOL DISTRICT,0.00%,5,479,20.00%
EAST SAC COUNTY COMM SCHOOL DISTRICT,25.00%,4,971,50.00%
EAST UNION COMM SCHOOL DISTRICT,50.00%,2,511,50.00%
EASTERN ALLAMAKEE COMM SCHOOL DISTRICT,33.33%,3,371,66.67%
EASTON VALLEY COMM SCHOOL DISTRICT,0.00%,3,508,66.67%
EDDYVILLE-BLAKESBURG- FREMONT CSD,0.00%,4,970,25.00%
EDGEWOOD-COLESBURG COMM SCHOOL DISTRICT,0.00%,2,560,100.00%
ELDORA-NEW PROVIDENCE COMM SCHOOL DISTRICT,0.00%,2,584,100.00%
ELK HORN-KIMBALLTON COMM SCHOOL DISTRICT,0.00%,2,,0.00%
EMMETSBURG COMM SCHOOL DISTRICT,0.00%,3,763,66.67%
ENGLISH VALLEYS COMM SCHOOL DISTRICT,50.00%,2,490,50.00%
ESSEX COMM SCHOOL DISTRICT,0.00%,2,240,50.00%
ESTHERVILLE LINCOLN CENTRAL COM SCH DIST,50.00%,4,1385,50.00%
EXIRA-ELK HORN-KIMBALLTON COMM SCHOOL DISTRICT,0.00%,3,392,100.00%
FAIRFIELD COMM SCHOOL DISTRICT,40.00%,5,1719,40.00%
FARRAGUT COMM SCHOOL DISTRICT,0.00%,2,167,50.00%
FOREST CITY COMM SCHOOL DISTRICT,25.00%,4,1175,50.00%
FORT DODGE COMM SCHOOL DISTRICT,33.33%,9,3765,55.56%
FORT MADISON COMM SCHOOL DISTRICT,20.00%,5,2044,40.00%
FREDERICKSBURG COMM SCHOOL DISTRICT,0.00%,2,,0.00%
FREMONT-MILLS COMM SCHOOL DISTRICT,0.00%,2,506,50.00%
GALVA-HOLSTEIN COMM SCHOOL DISTRICT,33.33%,3,442,100.00%
GARNER-HAYFIELD COMM SCHOOL DISTRICT,0.00%,2,868,50.00%
GEORGE-LITTLE ROCK COMM SCHOOL DISTRICT,0.00%,4,460,25.00%
GILBERT COMM SCHOOL DISTRICT,25.00%,4,1444,25.00%
GILMORE CITY-BRADGATE COMM SCHOOL DISTRICT,0.00%,2,42,0.00%
GLADBROOK-REINBECK COMM SCHOOL DISTRICT,25.00%,4,526,25.00%
GLENWOOD COMM SCHOOL DISTRICT,25.00%,4,2014,75.00%
GLIDDEN-RALSTON COMM SCHOOL DISTRICT,100.00%,2,335,100.00%
GMG COMM SCHOOL DISTRICT,0.00%,2,504,100.00%
GRAETTINGER-TERRIL COMM SCHOOL DISTRICT,33.33%,3,386,66.67%
GREENE COUNTY COMM SCHOOL DISTRICT,25.00%,4,1322,50.00%
GRINNELL-NEWBURG COMM SCHOOL DISTRICT,40.00%,5,1684,40.00%
GRISWOLD COMM SCHOOL DISTRICT,100.00%,3,540,100.00%
GRUNDY CENTER COMM SCHOOL DISTRICT,33.33%,3,661,33.33%
GUTHRIE CENTER COMM SCHOOL DISTRICT,0.00%,3,561,33.33%
H-L-V COMM SCHOOL DISTRICT,0.00%,2,362,50.00%
HAMBURG COMM SCHOOL DISTRICT,0.00%,2,229,0.00%
HAMPTON-DUMONT COMM SCHOOL DISTRICT,50.00%,4,1260,75.00%
HARLAN COMM SCHOOL DISTRICT,50.00%,4,1549,50.00%
HARMONY COMM SCHOOL DISTRICT,0.00%,2,299,50.00%
HARRIS-LAKE PARK COMM SCHOOL DISTRICT,50.00%,2,377,50.00%
HARTLEY-MELVIN-SANBORN COMM SCHOOL DISTRICT,33.33%,3,653,33.33%
HIGHLAND COMM SCHOOL DISTRICT,25.00%,4,695,25.00%
HINTON COMM SCHOOL DISTRICT,0.00%,3,778,33.33%
HOWARD-WINNESHIEK COMM SCHOOL DISTRICT,25.00%,8,1208,25.00%
HUBBARD-RADCLIFFE COMM SCHOOL DISTRICT,0.00%,2,388,50.00%
HUDSON COMM SCHOOL DISTRICT,33.33%,3,705,66.67%
HUMBOLDT COMM SCHOOL DISTRICT,50.00%,4,1455,75.00%
IKM-MANNING COMM SCHOOL DISTRICT,50.00%,4,697,75.00%
INDEPENDENCE COMM SCHOOL DISTRICT,0.00%,4,1370,25.00%
INDIANOLA COMM SCHOOL DISTRICT,50.00%,6,3641,66.67%
INTERSTATE 35 COMM SCHOOL DISTRICT,50.00%,4,871,75.00%
IOWA CITY COMM SCHOOL DISTRICT,40.00%,25,13266,68.00%
IOWA FALLS COMM SCHOOL DISTRICT,50.00%,4,1168,75.00%
IOWA VALLEY COMM SCHOOL DISTRICT,50.00%,2,576,50.00%
JANESVILLE CONSOLIDATED SCHOOL DISTRICT,0.00%,2,380,50.00%
JESUP COMM SCHOOL DISTRICT,16.67%,6,1000,33.33%
JOHNSTON COMM SCHOOL DISTRICT,37.50%,8,6819,75.00%
KEOKUK COMM SCHOOL DISTRICT,0.00%,5,1911,40.00%
KEOTA COMM SCHOOL DISTRICT,0.00%,2,342,50.00%
KINGSLEY-PIERSON COMM SCHOOL DISTRICT,25.00%,4,434,75.00%
KNOXVILLE COMM SCHOOL DISTRICT,20.00%,5,1788,60.00%
LAKE MILLS COMM SCHOOL DISTRICT,33.33%,3,742,100.00%
LAMONI COMM SCHOOL DISTRICT,33.33%,3,364,66.67%
LAURENS-MARATHON COMM SCHOOL DISTRICT,0.00%,3,286,33.33%
LAWTON-BRONSON COMM SCHOOL DISTRICT,0.00%,2,640,50.00%
LE MARS COMM SCHOOL DISTRICT,0.00%,6,2097,33.33%
LENOX COMM SCHOOL DISTRICT,0.00%,2,511,50.00%
LEWIS CENTRAL COMM SCHOOL DISTRICT,25.00%,4,3145,25.00%
LINN-MAR COMM SCHOOL DISTRICT,20.00%,10,7199,20.00%
LISBON COMM SCHOOL DISTRICT,66.67%,3,694,100.00%
LOGAN-MAGNOLIA COMM SCHOOL DISTRICT,0.00%,2,664,50.00%
LONE TREE COMM SCHOOL DISTRICT,0.00%,2,479,50.00%
LOUISA-MUSCATINE COMM SCHOOL DISTRICT,0.00%,3,879,66.67%
LUVERNE COMM SCHOOL DISTRICT,0.00%,1,81,0.00%
LYNNVILLE-SULLY COMM SCHOOL DISTRICT,33.33%,3,467,66.67%
MADRID COMM SCHOOL DISTRICT,0.00%,3,693,33.33%
MANSON NORTHWEST WEBSTER COMM SCHOOL DISTRICT,0.00%,2,746,50.00%
MAPLE VALLEY-ANTHON OTO COMM SCHOOL DISTRICT,0.00%,4,638,50.00%
MAQUOKETA COMM SCHOOL DISTRICT,75.00%,4,1425,75.00%
MAQUOKETA VALLEY COMM SCHOOL DISTRICT,0.00%,5,737,20.00%
MARCUS-MERIDEN-CLEGHORN COMM SCHOOL DISTRICT,0.00%,3,430,33.33%
MARION INDEPENDENT SCHOOL DISTRICT,50.00%,6,2063,50.00%
MARSHALLTOWN COMM SCHOOL DISTRICT,22.22%,9,5033,33.33%
MARTENSDALE-ST MARYS COMM SCHOOL DISTRICT,50.00%,2,575,50.00%
MASON CITY COMM SCHOOL DISTRICT,12.50%,8,3920,37.50%
MEDIAPOLIS COMM SCHOOL DISTRICT,0.00%,3,858,66.67%
MELCHER-DALLAS COMM SCHOOL DISTRICT,33.33%,3,387,66.67%
MESKWAKI SETTLEMENT SCHOOL,0.00%,1,,100.00%
MFL MARMAC COMM SCHOOL DISTRICT,0.00%,4,808,25.00%
MID-PRAIRIE COMM SCHOOL DISTRICT,16.67%,6,1326,33.33%
MIDLAND COMM SCHOOL DISTRICT,50.00%,2,500,50.00%
MISSOURI VALLEY COMM SCHOOL DISTRICT,66.67%,3,784,100.00%
MOC-FLOYD VALLEY COMM SCHOOL DISTRICT,50.00%,4,1380,50.00%
MONTEZUMA COMM SCHOOL DISTRICT,33.33%,3,538,66.67%
MONTICELLO COMM SCHOOL DISTRICT,50.00%,4,1109,50.00%
MORAVIA COMM SCHOOL DISTRICT,0.00%,2,400,50.00%
MORMON TRAIL COMM SCHOOL DISTRICT,0.00%,2,238,50.00%
MORNING SUN COMM SCHOOL DISTRICT,0.00%,1,129,0.00%
MOULTON-UDELL COMM SCHOOL DISTRICT,0.00%,2,223,50.00%
MOUNT AYR COMM SCHOOL DISTRICT,0.00%,2,629,50.00%
MOUNT PLEASANT COMM SCHOOL DISTRICT,0.00%,7,2022,28.57%
MOUNT VERNON COMM SCHOOL DISTRICT,0.00%,3,1300,33.33%
MURRAY COMM SCHOOL DISTRICT,50.00%,2,345,50.00%
MUSCATINE COMM SCHOOL DISTRICT,9.09%,11,5325,27.27%
NASHUA-PLAINFIELD COMM SCHOOL DISTRICT,25.00%,4,655,25.00%
NEVADA COMM SCHOOL DISTRICT,33.33%,3,1640,66.67%
NEW HAMPTON COMM SCHOOL DISTRICT,50.00%,4,1077,100.00%
NEW LONDON COMM SCHOOL DISTRICT,50.00%,2,529,100.00%
NEWELL-FONDA COMM SCHOOL DISTRICT,25.00%,4,501,25.00%
NEWTON COMM SCHOOL DISTRICT,12.50%,8,2954,37.50%
NODAWAY VALLEY COMM SCHOOL DISTRICT,0.00%,3,673,66.67%
NORTH BUTLER COMM SCHOOL DISTRICT,0.00%,4,727,25.00%
NORTH CEDAR COMM SCHOOL DISTRICT,0.00%,4,816,50.00%
NORTH FAYETTE COMM SCHOOL DISTRICT,40.00%,5,820,40.00%
NORTH IOWA COMM SCHOOL DISTRICT,66.67%,3,488,100.00%
NORTH KOSSUTH COMM SCHOOL DISTRICT,0.00%,2,297,0.00%
NORTH LINN COMM SCHOOL DISTRICT,0.00%,3,666,66.67%
NORTH MAHASKA COMM SCHOOL DISTRICT,50.00%,2,548,50.00%
NORTH POLK COMM SCHOOL DISTRICT,25.00%,4,1536,25.00%
NORTH SCOTT COMM SCHOOL DISTRICT,28.57%,7,3177,28.57%
NORTH TAMA COUNTY COMM SCHOOL DISTRICT,0.00%,2,476,100.00%
NORTH UNION COMM SCHOOL DISTRICT,50.00%,2,410,50.00%
NORTH WINNESHIEK COMM SCHOOL DISTRICT,0.00%,2,143,0.00%
NORTHEAST COMM SCHOOL DISTRICT,0.00%,2,875,50.00%
NORTHEAST HAMILTON COMM SCHOOL DISTRICT,33.33%,3,193,66.67%
NORTHWOOD-KENSETT COMM SCHOOL DISTRICT,0.00%,2,562,50.00%
NORWALK COMM SCHOOL DISTRICT,50.00%,4,2669,50.00%
ODEBOLT-ARTHUR COMM SCHOOL DISTRICT,50.00%,2,398,50.00%
OELWEIN COMM SCHOOL DISTRICT,0.00%,5,1299,20.00%
OGDEN COMM SCHOOL DISTRICT,33.33%,3,705,33.33%
OKOBOJI COMM SCHOOL DISTRICT,66.67%,3,991,66.67%
OLIN CONSOLIDATED SCHOOL DISTRICT,0.00%,1,96,0.00%
ORIENT-MACKSBURG COMM SCHOOL DISTRICT,0.00%,2,166,50.00%
OSAGE COMM SCHOOL DISTRICT,33.33%,3,982,100.00%
OSKALOOSA COMM SCHOOL DISTRICT,0.00%,4,2448,75.00%
OTTUMWA COMM SCHOOL DISTRICT,14.29%,14,4518,28.57%
PANORAMA COMM SCHOOL DISTRICT,33.33%,3,750,66.67%
PATON-CHURDAN COMM SCHOOL DISTRICT,0.00%,2,223,50.00%
PCM COMM SCHOOL DISTRICT,50.00%,4,1162,100.00%
PEKIN COMM SCHOOL DISTRICT,0.00%,3,719,66.67%
PELLA COMM SCHOOL DISTRICT,20.00%,5,2264,40.00%
PERRY COMM SCHOOL DISTRICT,33.33%,3,1774,66.67%
PLEASANT VALLEY COMM SCHOOL DISTRICT,28.57%,7,4383,28.57%
PLEASANTVILLE COMM SCHOOL DISTRICT,66.67%,3,715,66.67%
POCAHONTAS AREA COMM SCHOOL DISTRICT,0.00%,4,659,75.00%
POSTVILLE COMM SCHOOL DISTRICT,100.00%,2,656,100.00%
PRAIRIE VALLEY COMM SCHOOL DISTRICT,50.00%,2,568,100.00%
PRESCOTT COMM SCHOOL DISTRICT,0.00%,1,38,0.00%
PRESTON COMM SCHOOL DISTRICT,0.00%,2,,0.00%
RED OAK COMM SCHOOL DISTRICT,0.00%,5,1145,20.00%
REMSEN-UNION COMM SCHOOL DISTRICT,0.00%,3,377,33.33%
RICEVILLE COMM SCHOOL DISTRICT,0.00%,2,330,100.00%
RIVER VALLEY COMM SCHOOL DISTRICT,50.00%,2,444,50.00%
RIVERSIDE COMM SCHOOL DISTRICT,33.33%,3,649,66.67%
ROCK VALLEY COMM SCHOOL DISTRICT,0.00%,2,820,100.00%
ROCKWELL CITY-LYTTON COMM SCHOOL DISTRICT,0.00%,2,,0.00%
ROLAND-STORY COMM SCHOOL DISTRICT,33.33%,3,1100,100.00%
RUDD-ROCKFORD-MARBLE RK COMM SCHOOL DISTRICT,50.00%,2,486,100.00%
RUTHVEN-AYRSHIRE COMM SCHOOL DISTRICT,50.00%,2,203,50.00%
SAYDEL COMM SCHOOL DISTRICT,33.33%,3,1353,33.33%
SCHALLER-CRESTLAND COMM SCHOOL DISTRICT,50.00%,2,369,50.00%
SCHLESWIG COMM SCHOOL DISTRICT,0.00%,2,200,0.00%
SENTRAL COMM SCHOOL DISTRICT,0.00%,1,,0.00%
SERGEANT BLUFF-LUTON COMM SCHOOL DISTRICT,25.00%,4,1583,25.00%
SEYMOUR COMM SCHOOL DISTRICT,0.00%,2,266,50.00%
SHELDON COMM SCHOOL DISTRICT,33.33%,3,1001,33.33%
SHENANDOAH COMM SCHOOL DISTRICT,33.33%,3,1042,66.67%
SIBLEY-OCHEYEDAN COMM SCHOOL DISTRICT,33.33%,3,823,66.67%
SIDNEY COMM SCHOOL DISTRICT,100.00%,2,378,100.00%
SIGOURNEY COMM SCHOOL DISTRICT,0.00%,2,575,100.00%
SIOUX CENTER COMM SCHOOL DISTRICT,33.33%,3,1167,33.33%
SIOUX CENTRAL COMM SCHOOL DISTRICT,0.00%,3,636,33.33%
SIOUX CITY COMM SCHOOL DISTRICT,20.00%,25,13949,24.00%
SOLON COMM SCHOOL DISTRICT,33.33%,3,1448,66.67%
SOUTH CENTRAL CALHOUN COMM SCHOOL DISTRICT,0.00%,3,948,33.33%
SOUTH HAMILTON COMM SCHOOL DISTRICT,0.00%,2,724,50.00%
SOUTH O'BRIEN COMM SCHOOL DISTRICT,50.00%,2,626,50.00%
SOUTH PAGE COMM SCHOOL DISTRICT,0.00%,2,147,50.00%
SOUTH TAMA COUNTY COMM SCHOOL DISTRICT,33.33%,3,1517,66.67%
SOUTH WINNESHIEK COMM SCHOOL DISTRICT,33.33%,3,538,33.33%
SOUTHEAST POLK COMM SCHOOL DISTRICT,18.18%,11,6920,54.55%
SOUTHEAST WARREN COMM SCHOOL DISTRICT,33.33%,3,511,33.33%
SOUTHEAST WEBSTER GRAND COMM SCHOOL DISTRICT,0.00%,5,564,20.00%
SPENCER COMM SCHOOL DISTRICT,20.00%,5,2044,60.00%
SPIRIT LAKE COMM SCHOOL DISTRICT,66.67%,3,1275,66.67%
SPRINGVILLE COMM SCHOOL DISTRICT,50.00%,2,379,50.00%
ST ANSGAR COMM SCHOOL DISTRICT,66.67%,3,659,66.67%
STANTON COMM SCHOOL DISTRICT,0.00%,2,228,50.00%
STARMONT COMM SCHOOL DISTRICT,0.00%,3,616,33.33%
STORM LAKE COMM SCHOOL DISTRICT,40.00%,5,2374,80.00%
STRATFORD COMM SCHOOL DISTRICT,0.00%,1,102,0.00%
SUMNER-FREDERICKSBURG COMM SCHOOL DISTRICT,0.00%,4,825,25.00%
TIPTON COMM SCHOOL DISTRICT,66.67%,3,963,100.00%
TITONKA CONSOLIDATED SCHOOL DISTRICT,0.00%,2,,0.00%
TREYNOR COMM SCHOOL DISTRICT,33.33%,3,775,33.33%
TRI-CENTER COMM SCHOOL DISTRICT,33.33%,3,715,33.33%
TRI-COUNTY COMM SCHOOL DISTRICT,0.00%,3,263,33.33%
TRIPOLI COMM SCHOOL DISTRICT,0.00%,2,442,50.00%
TURKEY VALLEY COMM SCHOOL DISTRICT,50.00%,2,385,50.00%
TWIN CEDARS COMM SCHOOL DISTRICT,0.00%,2,382,50.00%
TWIN RIVERS COMM SCHOOL DISTRICT,0.00%,1,66,100.00%
UNDERWOOD COMM SCHOOL DISTRICT,66.67%,3,790,100.00%
UNION COMM SCHOOL DISTRICT,50.00%,4,1202,50.00%
UNITED COMM SCHOOL DISTRICT,50.00%,2,274,50.00%
URBANDALE COMM SCHOOL DISTRICT,0.00%,8,4114,12.50%
VALLEY COMM SCHOOL DISTRICT,0.00%,3,396,0.00%
VAN BUREN COMM SCHOOL DISTRICT,0.00%,2,606,50.00%
VAN METER COMM SCHOOL DISTRICT,100.00%,2,675,100.00%
VENTURA COMM SCHOOL DISTRICT,0.00%,2,232,0.00%
VILLISCA COMM SCHOOL DISTRICT,0.00%,3,301,33.33%
VINTON-SHELLSBURG COMM SCHOOL DISTRICT,0.00%,4,1597,25.00%
WACO COMM SCHOOL DISTRICT,50.00%,2,466,50.00%
WALNUT COMM SCHOOL DISTRICT,0.00%,3,87,0.00%
WAPELLO COMM SCHOOL DISTRICT,0.00%,3,662,33.33%
WAPSIE VALLEY COMM SCHOOL DISTRICT,0.00%,7,756,14.29%
WASHINGTON COMM SCHOOL DISTRICT,25.00%,4,1733,25.00%
WATERLOO COMM SCHOOL DISTRICT,31.58%,19,11084,52.63%
WAUKEE COMM SCHOOL DISTRICT,50.00%,12,8637,58.33%
WAVERLY-SHELL ROCK COMM SCHOOL DISTRICT,14.29%,7,2152,57.14%
WAYNE COMM SCHOOL DISTRICT,100.00%,2,549,100.00%
WEBSTER CITY COMM SCHOOL DISTRICT,40.00%,5,1602,60.00%
WEST BEND-MALLARD COMM SCHOOL DISTRICT,0.00%,3,368,33.33%
WEST BRANCH COMM SCHOOL DISTRICT,66.67%,3,864,100.00%
WEST BURLINGTON IND SCHOOL DISTRICT,0.00%,3,931,66.67%
WEST CENTRAL COMM SCHOOL DISTRICT,0.00%,3,276,66.67%
WEST CENTRAL VALLEY COMM SCHOOL DISTRICT,25.00%,4,886,75.00%
WEST DELAWARE COUNTY COMM SCHOOL DISTRICT,0.00%,3,1501,66.67%
WEST DES MOINES COMM SCHOOL DISTRICT,21.43%,14,9217,71.43%
WEST FORK CSD,25.00%,4,707,50.00%
WEST HANCOCK COMM SCHOOL DISTRICT,33.33%,3,664,66.67%
WEST HARRISON COMM SCHOOL DISTRICT,50.00%,2,333,100.00%
WEST LIBERTY COMM SCHOOL DISTRICT,25.00%,4,1282,25.00%
WEST LYON COMM SCHOOL DISTRICT,0.00%,3,920,100.00%
WEST MARSHALL COMM SCHOOL DISTRICT,0.00%,3,989,33.33%
WEST MONONA COMM SCHOOL DISTRICT,0.00%,5,679,20.00%
WEST SIOUX COMM SCHOOL DISTRICT,25.00%,4,753,50.00%
WESTERN DUBUQUE COMM SCHOOL DISTRICT,11.11%,9,3306,55.56%
WESTWOOD COMM SCHOOL DISTRICT,50.00%,2,561,100.00%
WHITING COMM SCHOOL DISTRICT,0.00%,2,203,50.00%
WILLIAMSBURG COMM SCHOOL DISTRICT,50.00%,2,1179,100.00%
WILTON COMM SCHOOL DISTRICT,0.00%,2,857,50.00%
WINFIELD-MT UNION COMM SCHOOL DISTRICT,50.00%,2,466,50.00%
WINTERSET COMM SCHOOL DISTRICT,20.00%,5,1802,60.00%
WOODBINE COMM SCHOOL DISTRICT,0.00%,2,503,50.00%
WOODBURY CENTRAL COMM SCHOOL DISTRICT,33.33%,3,613,66.67%
WOODWARD-GRANGER COMM SCHOOL DISTRICT,0.00%,5,1175,40.00%